<?xml version="1.0" encoding="UTF-8"?>
<edificis xmlns:xsi="http://www.w3.org/2001/XMLSchema-instance"
xsi:noNamespaceSchemaLocation="xsd/edificis.xsd">
    <ciutat>
        <nom>
            Barcelona
        </nom>
        <carrer>
            Balmes
        </carrer>
        <Oficines>
            <num>
                5
            </num>
            <Planta>
                <num>
                    1
                </num>
                <oficina>
                    tamany = 150m
                </oficina>
            </Planta>
            <Planta>
                <num>
                    2
                </num>
                <oficina>
                    tamany = 70m
                </oficina>
                <oficina>
                    tamany = 70m
                </oficina>
            </Planta>
        </Oficines>
        <habitatge>
            <num>
                7
            </num>
            <botiga>
                tamany = 150m
            </botiga>
            <Planta>
                <num>
                    1
                </num>
                <pis num="1">
                    tamany = 60m
                </pis>
                <pis num="2">
                    tamany = 60m
                </pis>
                <pis num="3">
                    tamany = 60m
                </pis>
            </Planta>
            <Planta>
                <num>
                    2
                </num>
                <pis num="1">
                    tamany = 60m
                </pis>
                <pis num="2">
                    tamany = 60m
                </pis>
                <pis num="3">
                    tamany = 60m
                </pis> 
            </Planta>
            <Planta>
                <num>
                    3
                </num>
                <pis num="1">
                    tamany = 60m
                </pis>
                <pis num="2">
                    tamany = 60m
                </pis>
                <pis num="3">
                    tamany = 60m
                </pis>
            </Planta>
            <Planta num="4">
                <num>
                    4
                </num>
                <pis num="1">
                    tamany = 60m
                </pis>
                <pis num="2">
                    tamany = 60m
                </pis>
                <pis num="3">
                    tamany = 60m
                </pis>
            </Planta>
            <Planta num="5">
                <pis num="1" tamany="70">
                    <terrasa tamany="15">
                        
                    </terrasa>
                </pis>
            </Planta>
        </habitatge>
    </ciutat>
</edificis>